{
  "$schema": "http://json-schema.org/draft-07/schema#",
  "type": "object",
  "x-schemaVersion": 1,
  "x-sectionKey": "overview",
  "title": "Overview",
  "properties": {
    "pi_budget": {
      "type": "number",
      "title": "PI Budget"
    },
    "final_recommended_budget": {
      "type": "number",
      "title": "Final Recommended Budget"
    },
    "program_manager": {
      "type": "string",
      "title": "Program Manager"
    },
    "contract_grants_specialist": {
      "type": "string",
      "title": "Contract/Grants Specialist"
    },
    "branch_chief": {
      "type": "string",
      "title": "Branch Chief"
    },
    "pi_notification_date": {
      "type": "string",
      "format": "date",
      "title": "PI Notification Date"
    },
    "safety_checklist_submitted": {
      "type": "string",
      "format": "date",
      "title": "Safety Checklist Submitted"
    },
    "animal_research_checklist_submitted": {
      "type": "string",
      "format": "date",
      "title": "Animal Research Checklist Submitted"
    },
    "human_research_checklist_submitted": {
      "type": "string",
      "format": "date",
      "title": "Human Research Checklist Submitted"
    },
    "acquisition_checklist_submitted": {
      "type": "string",
      "format": "date",
      "title": "Acquisition Checklist Submitted to Finance"
    },
    "prime_award_type": {
      "type": "string",
      "title": "Prime Award (Intra/Extra)",
      "enum": ["extramural", "intramural", "extramural_intramural", "intramural_extramural"],
      "enumNames": ["Extramural", "Intramural", "Extramural/Intramural", "Intramural/Extramural"],
      "default": "extramural"
    },
    "personnel": {
      "type": "array",
      "title": "Project Personnel",
      "items": {
        "type": "object",
        "required": ["name", "organization", "project_role"],
        "properties": {
          "name": { "type": "string", "title": "Name" },
          "organization": { "type": "string", "title": "Organization" },
          "country": { "type": "string", "title": "Country", "default": "USA" },
          "project_role": { "type": "string", "title": "Project Role" },
          "is_subcontract": { "type": "boolean", "title": "Subcontract", "default": false }
        }
      }
    },
    "overview_notes": {
      "type": "string",
      "title": "Overview Notes"
    }
  }
}
